{
  "schemaVersion": 1,
  "scopeID": "scope-demo",
  "selectedEpisodeIDs": [
    "episode-1",
    "episode-2"
  ],
  "analyzedEpisodeIDs": [
    "episode-1",
    "episode-2"
  ],
  "usedEpisodeIDs": [
    "episode-1"
  ],
  "claims": [
    {
      "kind": "sourceStatement",
      "text": "Ein lokales Modell kann Anfragen ohne externen Modellanbieter verarbeiten.",
      "evidenceIDs": [
        "ev-1-0"
      ]
    }
  ],
  "status": "answered",
  "limitations": [
    "Synthetische Testdaten; kein realer Podcast."
  ]
}
